{
  "schema_version": "v1alpha1",
  "dri_binding_id": "19887415-bb68-438b-9599-0b07b5f13e97",
  "taskpack_id": "4e1fe00c-6303-453c-8cb6-2c34f84896e4",
  "owner": {
    "actor_id": "0a3657eb-2f37-4614-a8a7-9c6bd51714a8",
    "actor_type": "agent",
    "display_name": "payments-dri",
    "orchestrator": "langgraph",
    "model": "anthropic:claude-sonnet-4"
  },
  "reviewers": [
    {
      "actor_id": "4ea6b08c-e80b-477f-b403-f3e4a5a71a2d",
      "actor_type": "agent",
      "display_name": "skeptic-reviewer",
      "orchestrator": "openai-agents",
      "model": "openai:gpt-5.4"
    }
  ],
  "specialists": [
    {
      "actor_id": "1ac0edb2-6b91-4fbb-adf0-62be9da8c705",
      "actor_type": "agent",
      "display_name": "test-specialist",
      "orchestrator": "hermes",
      "model": "google:gemini-2.5-pro"
    }
  ],
  "approvers": [
    {
      "actor_id": "52a203e8-0a20-4f0b-9b3d-78631e00d6ab",
      "actor_type": "human",
      "display_name": "Quentin"
    }
  ],
  "escalation_policy": {
    "mode": "time_based",
    "escalate_after_seconds": 1800,
    "targets": [
      {
        "actor_id": "52a203e8-0a20-4f0b-9b3d-78631e00d6ab",
        "actor_type": "human",
        "display_name": "Quentin"
      }
    ]
  },
  "approval_policy": {
    "required_for": [
      "external_write",
      "cost_overrun"
    ],
    "min_approvals": 1
  },
  "visibility_policy": {
    "mode": "project"
  },
  "status": "assigned",
  "created_at": "2026-04-24T10:01:00Z"
}

